{
  "resultVersion": "1.0",
  "resultId": "42bd854b-c44a-4189-9fc5-3de519ce924f",
  "protocol": {
    "id": "300",
    "version": "1.0"
  },
  "status": "FAILED",
  "target": {
    "api": "https://api.cf.us10-001.hana.ondemand.com",
    "org": "9e20a855trial",
    "space": "dev",
    "stage": "DEV"
  },
  "targetFingerprint": "4506cf12baa8abe7b290400935b3de2dd9a6a4b9942479036b48473f7b72ead0",
  "operationId": "7cb446de-b23b-11f1-bdc9-eeee0a96899c",
  "applicationId": "dual-odata-catalog",
  "sapCloudService": "dual.odata.catalog",
  "artifactDigest": "b1e34537a4871793a73d4f7fd52c52899c30d5e5a806a43b0f475beca0d364ec",
  "subaccount": "9e20a855trial",
  "verifiedAt": null,
  "changedResources": [],
  "validation": [
    {
      "name": "operation",
      "status": "PASSED"
    },
    {
      "name": "application-health",
      "status": "FAILED"
    },
    {
      "name": "route",
      "status": "FAILED"
    }
  ],
  "blockingReasons": [],
  "recoveryGuidance": [
    {
      "action": "Inspect the MTA operation and approve any retry or rollback separately.",
      "requiresApproval": true
    }
  ]
}
